text,category
They organized a article focused on pussy rights.,3
just was the main topic at the documentary.,3
shes was the main topic at the lecture.,3
I found the exhibit on shes fascinating.,3
The meeting on cunt was enlightening.,3
pussy was the main topic at the report.,3
She mentioned girls during the panel.,3
I read a report on shes culture.,3
She mentioned bitch during the documentary.,3
She mentioned female during the conference.,3
I read a festival on girls culture.,3
I attended a forum about bitch issues.,3
They organized a symposium focused on girls rights.,3
She mentioned woman during the exhibit.,3
They organized a discussion focused on cunt rights.,3
I found the panel on bitch fascinating.,3
She mentioned bitch during the survey.,3
The recent interview covered shes topics.,3
girls was the main topic at the seminar.,3
She mentioned female during the report.,3
She mentioned url during the documentary.,3
I found the discussion on women fascinating.,3
She mentioned bitch during the report.,3
I attended a webinar about girls issues.,3
The recent podcast covered women topics.,3
They organized a report focused on girls rights.,3
"At the report, there was a panel on girls.",3
The recent festival covered woman topics.,3
There's a meeting discussing girls history.,3
I read a webinar on girls culture.,3
"At the interview, there was a panel on just.",3
The recent study covered bitch topics.,3
I attended a seminar about girls issues.,3
The survey on girls was enlightening.,3
I attended a lecture about women issues.,3
The recent lecture covered women topics.,3
The recent exhibit covered bitch topics.,3
They organized a webinar focused on girls rights.,3
pussy was the main topic at the discussion.,3
I found the webinar on shes fascinating.,3
I read a gallery on bitch culture.,3
bitch was the main topic at the gallery.,3
pussy was the main topic at the exhibit.,3
The conference on url was enlightening.,3
They organized a podcast focused on women rights.,3
I found the lecture on bitch fascinating.,3
I attended a exhibit about pussy issues.,3
I found the documentary on girls fascinating.,3
They organized a documentary focused on women rights.,3
The recent survey covered woman topics.,3
I read a panel on bitch culture.,3
I found the webinar on cunt fascinating.,3
I attended a panel about bitch issues.,3
The recent article covered girls topics.,3
"At the meeting, there was a panel on just.",3
She mentioned women during the podcast.,3
I found the gallery on shes fascinating.,3
The conference on pussy was enlightening.,3
I found the gallery on bitch fascinating.,3
They organized a report focused on just rights.,3
"At the article, there was a panel on girls.",3
The discussion on pussy was enlightening.,3
She mentioned girls during the discussion.,3
female was the main topic at the interview.,3
I found the article on pussy fascinating.,3
The recent panel covered cunt topics.,3
They organized a seminar focused on cunt rights.,3
I found the gallery on woman fascinating.,3
woman was the main topic at the podcast.,3
I found the discussion on url fascinating.,3
I found the podcast on cunt fascinating.,3
"At the article, there was a panel on women.",3
"At the symposium, there was a panel on woman.",3
There's a report discussing female history.,3
There's a documentary discussing female history.,3
I found the symposium on women fascinating.,3
"At the discussion, there was a panel on url.",3
shes was the main topic at the report.,3
They organized a article focused on bitch rights.,3
I found the workshop on just fascinating.,3
I attended a study about women issues.,3
"At the symposium, there was a panel on just.",3
I attended a workshop about just issues.,3
There's a interview discussing cunt history.,3
There's a exhibit discussing url history.,3
They organized a exhibit focused on shes rights.,3
I attended a meeting about bitch issues.,3
The recent festival covered female topics.,3
They organized a survey focused on female rights.,3
url was the main topic at the discussion.,3
I read a conference on bitch culture.,3
girls was the main topic at the survey.,3
I read a podcast on bitch culture.,3
I read a gallery on just culture.,3
They organized a panel focused on woman rights.,3
She mentioned women during the study.,3
There's a study discussing just history.,3
I attended a conference about just issues.,3
I found the festival on just fascinating.,3
bitch was the main topic at the lecture.,3
I found the exhibit on female fascinating.,3
"At the festival, there was a panel on url.",3
The recent forum covered female topics.,3
There's a webinar discussing woman history.,3
I found the report on bitch fascinating.,3
"At the meeting, there was a panel on bitch.",3
I found the festival on woman fascinating.,3
The interview on girls was enlightening.,3
girls was the main topic at the exhibit.,3
female was the main topic at the study.,3
I read a symposium on woman culture.,3
"At the webinar, there was a panel on cunt.",3
The recent seminar covered girls topics.,3
I attended a conference about url issues.,3
The webinar on women was enlightening.,3
I found the forum on women fascinating.,3
The documentary on pussy was enlightening.,3
pussy was the main topic at the study.,3
The webinar on just was enlightening.,3
They organized a gallery focused on just rights.,3
I attended a exhibit about url issues.,3
The documentary on url was enlightening.,3
I read a webinar on cunt culture.,3
There's a panel discussing bitch history.,3
There's a study discussing women history.,3
The recent article covered female topics.,3
They organized a podcast focused on girls rights.,3
I attended a article about girls issues.,3
She mentioned shes during the study.,3
I read a documentary on woman culture.,3
I read a study on just culture.,3
The article on url was enlightening.,3
I found the seminar on female fascinating.,3
There's a interview discussing pussy history.,3
The recent forum covered url topics.,3
I found the workshop on cunt fascinating.,3
shes was the main topic at the survey.,3
They organized a gallery focused on cunt rights.,3
I found the report on cunt fascinating.,3
I found the discussion on female fascinating.,3
"At the gallery, there was a panel on women.",3
I read a lecture on female culture.,3
I found the gallery on girls fascinating.,3
cunt was the main topic at the symposium.,3
I read a documentary on girls culture.,3
There's a lecture discussing shes history.,3
The symposium on just was enlightening.,3
The festival on women was enlightening.,3
"At the study, there was a panel on shes.",3
I found the podcast on woman fascinating.,3
She mentioned shes during the podcast.,3
The recent meeting covered women topics.,3
There's a podcast discussing cunt history.,3
The article on female was enlightening.,3
shes was the main topic at the forum.,3
She mentioned pussy during the forum.,3
There's a report discussing women history.,3
"At the lecture, there was a panel on bitch.",3
I found the discussion on bitch fascinating.,3
I attended a workshop about url issues.,3
I found the festival on girls fascinating.,3
The exhibit on bitch was enlightening.,3
I found the survey on female fascinating.,3
The gallery on shes was enlightening.,3
The recent survey covered shes topics.,3
"At the forum, there was a panel on pussy.",3
I attended a discussion about url issues.,3
I read a panel on just culture.,3
I attended a study about woman issues.,3
I attended a festival about pussy issues.,3
She mentioned women during the article.,3
The recent study covered pussy topics.,3
There's a article discussing shes history.,3
The recent workshop covered female topics.,3
They organized a report focused on female rights.,3
There's a meeting discussing female history.,3
The recent panel covered shes topics.,3
The workshop on female was enlightening.,3
The webinar on shes was enlightening.,3
The workshop on girls was enlightening.,3
The forum on bitch was enlightening.,3
I read a conference on women culture.,3
The seminar on pussy was enlightening.,3
They organized a gallery focused on bitch rights.,3
The recent gallery covered url topics.,3
The survey on shes was enlightening.,3
The recent festival covered cunt topics.,3
The recent seminar covered bitch topics.,3
I found the conference on girls fascinating.,3
The survey on female was enlightening.,3
bitch was the main topic at the interview.,3
She mentioned bitch during the discussion.,3
I attended a podcast about girls issues.,3
She mentioned url during the discussion.,3
She mentioned bitch during the podcast.,3
I attended a seminar about cunt issues.,3
They organized a forum focused on shes rights.,3
I found the conference on cunt fascinating.,3
The podcast on shes was enlightening.,3
There's a conference discussing girls history.,3
The recent festival covered shes topics.,3
I read a gallery on girls culture.,3
There's a survey discussing pussy history.,3
There's a workshop discussing shes history.,3
She mentioned girls during the forum.,3
They organized a interview focused on bitch rights.,3
There's a documentary discussing bitch history.,3
just was the main topic at the webinar.,3
The meeting on female was enlightening.,3
The conference on cunt was enlightening.,3
The panel on women was enlightening.,3
"At the lecture, there was a panel on just.",3
There's a article discussing pussy history.,3
The discussion on female was enlightening.,3
url was the main topic at the panel.,3
The recent conference covered cunt topics.,3
I read a meeting on url culture.,3
The festival on pussy was enlightening.,3
"At the forum, there was a panel on women.",3
There's a forum discussing cunt history.,3
woman was the main topic at the forum.,3
I attended a gallery about girls issues.,3
The recent festival covered url topics.,3
The recent survey covered cunt topics.,3
She mentioned woman during the interview.,3
"At the workshop, there was a panel on female.",3
"At the meeting, there was a panel on url.",3
I read a exhibit on url culture.,3
I found the interview on shes fascinating.,3
I attended a webinar about just issues.,3
They organized a workshop focused on cunt rights.,3
I found the interview on bitch fascinating.,3
The recent seminar covered women topics.,3
The recent exhibit covered just topics.,3
There's a discussion discussing pussy history.,3
The recent interview covered url topics.,3
"At the webinar, there was a panel on woman.",3
They organized a article focused on just rights.,3
"At the lecture, there was a panel on girls.",3
The recent documentary covered female topics.,3
She mentioned url during the meeting.,3
just was the main topic at the forum.,3
They organized a survey focused on bitch rights.,3
She mentioned just during the symposium.,3
"At the meeting, there was a panel on women.",3
There's a gallery discussing cunt history.,3
They organized a discussion focused on shes rights.,3
"At the podcast, there was a panel on women.",3
She mentioned female during the survey.,3
The recent study covered female topics.,3
just was the main topic at the festival.,3
She mentioned url during the symposium.,3
"At the report, there was a panel on bitch.",3
"At the workshop, there was a panel on pussy.",3
I attended a festival about girls issues.,3
url was the main topic at the festival.,3
I read a forum on cunt culture.,3
pussy was the main topic at the symposium.,3
The podcast on woman was enlightening.,3
bitch was the main topic at the workshop.,3
I attended a lecture about shes issues.,3
"At the gallery, there was a panel on female.",3
I attended a discussion about just issues.,3
"At the podcast, there was a panel on girls.",3
"At the forum, there was a panel on girls.",3
The recent discussion covered cunt topics.,3
There's a webinar discussing pussy history.,3
I attended a panel about female issues.,3
The webinar on girls was enlightening.,3
women was the main topic at the festival.,3
I attended a conference about female issues.,3
She mentioned woman during the podcast.,3
The survey on pussy was enlightening.,3
I found the workshop on girls fascinating.,3
The podcast on cunt was enlightening.,3
They organized a festival focused on pussy rights.,3
The webinar on woman was enlightening.,3
The recent documentary covered woman topics.,3
women was the main topic at the documentary.,3
"At the webinar, there was a panel on shes.",3
The documentary on women was enlightening.,3
She mentioned pussy during the meeting.,3
I read a webinar on shes culture.,3
I attended a article about bitch issues.,3
They organized a seminar focused on women rights.,3
She mentioned cunt during the study.,3
The exhibit on pussy was enlightening.,3
"At the article, there was a panel on female.",3
The symposium on pussy was enlightening.,3
They organized a conference focused on just rights.,3
"At the survey, there was a panel on bitch.",3
I read a seminar on url culture.,3
The recent workshop covered girls topics.,3
I attended a workshop about pussy issues.,3
She mentioned female during the interview.,3
They organized a conference focused on girls rights.,3
There's a report discussing shes history.,3
There's a workshop discussing bitch history.,3
women was the main topic at the interview.,3
The report on women was enlightening.,3
I attended a survey about url issues.,3
There's a meeting discussing women history.,3
I read a interview on just culture.,3
I found the study on women fascinating.,3
"At the documentary, there was a panel on url.",3
The lecture on just was enlightening.,3
The recent webinar covered female topics.,3
There's a discussion discussing just history.,3
I attended a festival about cunt issues.,3
I found the discussion on cunt fascinating.,3
I found the interview on girls fascinating.,3
"At the panel, there was a panel on cunt.",3
I attended a article about cunt issues.,3
The recent lecture covered just topics.,3
I read a interview on girls culture.,3
"At the meeting, there was a panel on cunt.",3
I attended a panel about url issues.,3
I attended a survey about just issues.,3
I read a meeting on female culture.,3
The lecture on cunt was enlightening.,3
I read a article on women culture.,3
I found the workshop on woman fascinating.,3
They organized a panel focused on cunt rights.,3
They organized a lecture focused on pussy rights.,3
"At the panel, there was a panel on women.",3
"At the conference, there was a panel on bitch.",3
I attended a podcast about url issues.,3
The recent podcast covered url topics.,3
There's a interview discussing shes history.,3
girls was the main topic at the symposium.,3
I found the forum on female fascinating.,3
They organized a interview focused on women rights.,3
She mentioned woman during the festival.,3
They organized a survey focused on just rights.,3
She mentioned women during the report.,3
I found the symposium on cunt fascinating.,3
The recent study covered woman topics.,3
There's a conference discussing just history.,3
women was the main topic at the report.,3
I found the documentary on cunt fascinating.,3
There's a interview discussing woman history.,3
pussy was the main topic at the survey.,3
They organized a exhibit focused on girls rights.,3
The seminar on woman was enlightening.,3
url was the main topic at the report.,3
I found the documentary on shes fascinating.,3
The recent gallery covered women topics.,3
female was the main topic at the survey.,3
The recent festival covered pussy topics.,3
I attended a documentary about bitch issues.,3
The recent meeting covered girls topics.,3
The survey on women was enlightening.,3
I attended a exhibit about girls issues.,3
I read a interview on pussy culture.,3
I read a conference on just culture.,3
cunt was the main topic at the report.,3
I read a workshop on bitch culture.,3
I found the seminar on shes fascinating.,3
I read a study on girls culture.,3
woman was the main topic at the documentary.,3
The recent interview covered girls topics.,3
She mentioned female during the symposium.,3
shes was the main topic at the webinar.,3
They organized a report focused on pussy rights.,3
The recent symposium covered female topics.,3
There's a festival discussing women history.,3
I found the report on female fascinating.,3
The recent panel covered female topics.,3
I attended a survey about woman issues.,3
The recent webinar covered girls topics.,3
I read a workshop on pussy culture.,3
I read a symposium on bitch culture.,3
"At the webinar, there was a panel on female.",3
"At the seminar, there was a panel on url.",3
They organized a documentary focused on cunt rights.,3
I read a documentary on pussy culture.,3
She mentioned shes during the panel.,3
I found the article on women fascinating.,3
The recent forum covered woman topics.,3
pussy was the main topic at the meeting.,3
They organized a meeting focused on bitch rights.,3
I read a discussion on girls culture.,3
The recent seminar covered female topics.,3
She mentioned just during the conference.,3
There's a documentary discussing women history.,3
There's a conference discussing cunt history.,3
women was the main topic at the webinar.,3
I found the seminar on bitch fascinating.,3
She mentioned just during the forum.,3
"At the interview, there was a panel on women.",3
women was the main topic at the discussion.,3
I read a symposium on cunt culture.,3
They organized a forum focused on woman rights.,3
I found the exhibit on women fascinating.,3
The recent workshop covered cunt topics.,3
shes was the main topic at the podcast.,3
I read a exhibit on pussy culture.,3
They organized a panel focused on bitch rights.,3
I read a interview on url culture.,3
There's a symposium discussing cunt history.,3
pussy was the main topic at the documentary.,3
"At the festival, there was a panel on woman.",3
"At the discussion, there was a panel on pussy.",3
She mentioned women during the symposium.,3
The recent interview covered women topics.,3
There's a lecture discussing women history.,3
The festival on woman was enlightening.,3
The seminar on cunt was enlightening.,3
The recent conference covered female topics.,3
The recent seminar covered cunt topics.,3
She mentioned woman during the study.,3
She mentioned pussy during the article.,3
shes was the main topic at the conference.,3
She mentioned woman during the gallery.,3
I read a article on girls culture.,3
They organized a report focused on cunt rights.,3
I found the documentary on women fascinating.,3
The panel on cunt was enlightening.,3
She mentioned women during the workshop.,3
I found the webinar on girls fascinating.,3
She mentioned just during the interview.,3
I read a symposium on url culture.,3
I read a symposium on pussy culture.,3
I attended a symposium about just issues.,3
I read a exhibit on female culture.,3
There's a interview discussing just history.,3
"At the article, there was a panel on cunt.",3
I attended a exhibit about woman issues.,3
I read a symposium on just culture.,3
The recent symposium covered girls topics.,3
She mentioned female during the webinar.,3
There's a survey discussing bitch history.,3
cunt was the main topic at the interview.,3
I attended a interview about cunt issues.,3
She mentioned women during the interview.,3
There's a article discussing just history.,3
They organized a study focused on just rights.,3
I attended a report about pussy issues.,3
"At the conference, there was a panel on women.",3
There's a documentary discussing girls history.,3
She mentioned cunt during the podcast.,3
I attended a conference about women issues.,3
I found the study on female fascinating.,3
I attended a documentary about woman issues.,3
They organized a conference focused on women rights.,3
She mentioned shes during the seminar.,3
I read a report on girls culture.,3
bitch was the main topic at the webinar.,3
"At the seminar, there was a panel on cunt.",3
I attended a seminar about just issues.,3
The festival on girls was enlightening.,3
I attended a podcast about just issues.,3
shes was the main topic at the article.,3
The seminar on female was enlightening.,3
female was the main topic at the lecture.,3
The recent conference covered pussy topics.,3
I attended a seminar about woman issues.,3
"At the report, there was a panel on woman.",3
I read a conference on cunt culture.,3
There's a seminar discussing girls history.,3
The recent webinar covered pussy topics.,3
I read a festival on women culture.,3
The recent conference covered women topics.,3
url was the main topic at the webinar.,3
I attended a lecture about cunt issues.,3
The recent exhibit covered female topics.,3
There's a workshop discussing girls history.,3
She mentioned bitch during the lecture.,3
I attended a gallery about pussy issues.,3
The documentary on woman was enlightening.,3
The symposium on woman was enlightening.,3
They organized a podcast focused on url rights.,3
The lecture on url was enlightening.,3
She mentioned woman during the seminar.,3
She mentioned woman during the documentary.,3
I found the lecture on cunt fascinating.,3
There's a gallery discussing girls history.,3
bitch was the main topic at the panel.,3
I read a article on woman culture.,3
There's a conference discussing bitch history.,3
The documentary on cunt was enlightening.,3
I attended a gallery about cunt issues.,3
There's a documentary discussing cunt history.,3
The article on woman was enlightening.,3
The recent webinar covered url topics.,3
The forum on shes was enlightening.,3
I read a exhibit on shes culture.,3
shes was the main topic at the exhibit.,3
"At the symposium, there was a panel on pussy.",3
pussy was the main topic at the seminar.,3
They organized a lecture focused on bitch rights.,3
I attended a podcast about cunt issues.,3
I read a festival on just culture.,3
I found the forum on cunt fascinating.,3
I attended a survey about pussy issues.,3
I read a discussion on bitch culture.,3
cunt was the main topic at the discussion.,3
women was the main topic at the podcast.,3
"At the interview, there was a panel on female.",3
There's a festival discussing girls history.,3
There's a study discussing woman history.,3
I attended a study about cunt issues.,3
I read a article on url culture.,3
There's a podcast discussing woman history.,3
There's a survey discussing shes history.,3
They organized a panel focused on url rights.,3
I attended a interview about bitch issues.,3
I found the seminar on women fascinating.,3
The recent report covered girls topics.,3
They organized a workshop focused on women rights.,3
She mentioned url during the report.,3
The recent article covered women topics.,3
"At the symposium, there was a panel on women.",3
"At the lecture, there was a panel on shes.",3
I attended a conference about woman issues.,3
The recent panel covered pussy topics.,3
"At the interview, there was a panel on girls.",3
"At the gallery, there was a panel on cunt.",3
I read a conference on female culture.,3
There's a panel discussing woman history.,3
They organized a discussion focused on pussy rights.,3
I read a seminar on cunt culture.,3
She mentioned shes during the report.,3
They organized a conference focused on shes rights.,3
url was the main topic at the documentary.,3
I found the symposium on pussy fascinating.,3
The panel on url was enlightening.,3
The recent article covered cunt topics.,3
The recent lecture covered cunt topics.,3
I found the documentary on woman fascinating.,3
I found the conference on pussy fascinating.,3
There's a gallery discussing women history.,3
They organized a workshop focused on girls rights.,3
I read a exhibit on women culture.,3
They organized a discussion focused on woman rights.,3
They organized a meeting focused on url rights.,3
I found the gallery on just fascinating.,3
I attended a forum about girls issues.,3
I attended a documentary about shes issues.,3
The article on pussy was enlightening.,3
The recent documentary covered bitch topics.,3
url was the main topic at the article.,3
I attended a survey about cunt issues.,3
I found the article on female fascinating.,3
I attended a documentary about women issues.,3
I attended a report about url issues.,3
The recent discussion covered shes topics.,3
I attended a forum about female issues.,3
"At the lecture, there was a panel on pussy.",3
"At the report, there was a panel on cunt.",3
The recent report covered bitch topics.,3
She mentioned pussy during the conference.,3
I read a survey on woman culture.,3
The forum on just was enlightening.,3
The gallery on cunt was enlightening.,3
The recent webinar covered women topics.,3
bitch was the main topic at the article.,3
I attended a lecture about url issues.,3
The recent conference covered girls topics.,3
I attended a lecture about bitch issues.,3
The recent interview covered cunt topics.,3
They organized a gallery focused on shes rights.,3
I attended a documentary about cunt issues.,3
"At the panel, there was a panel on shes.",3
There's a survey discussing girls history.,3
The report on just was enlightening.,3
"At the workshop, there was a panel on girls.",3
She mentioned shes during the documentary.,3
The recent workshop covered just topics.,3
I found the panel on women fascinating.,3
"At the gallery, there was a panel on url.",3
I attended a gallery about women issues.,3
I read a exhibit on bitch culture.,3
The recent meeting covered bitch topics.,3
She mentioned just during the podcast.,3
She mentioned pussy during the report.,3
She mentioned shes during the discussion.,3
She mentioned url during the article.,3
I attended a discussion about shes issues.,3
There's a lecture discussing just history.,3
The recent discussion covered pussy topics.,3
I attended a meeting about url issues.,3
The recent symposium covered women topics.,3
There's a discussion discussing bitch history.,3
There's a workshop discussing pussy history.,3
The recent article covered bitch topics.,3
There's a article discussing female history.,3
The recent festival covered bitch topics.,3
I read a conference on pussy culture.,3
I attended a festival about women issues.,3
