text,category
The study on jews was enlightening.,3
"At the festival, there was a panel on islamic.",3
They organized a study focused on islamic rights.,3
The recent exhibit covered jews topics.,3
She mentioned religion during the discussion.,3
The conference on muslim was enlightening.,3
I attended a meeting about islamic issues.,3
The exhibit on muslims was enlightening.,3
I found the interview on muslim fascinating.,3
There's a webinar discussing muslims history.,3
I attended a study about mohammed issues.,3
rt was the main topic at the forum.,3
They organized a panel focused on muslim rights.,3
The recent podcast covered mohammed topics.,3
The recent lecture covered islamic topics.,3
She mentioned muslim during the podcast.,3
The meeting on islamic was enlightening.,3
I found the study on rt fascinating.,3
The recent meeting covered islamic topics.,3
religion was the main topic at the report.,3
She mentioned muslim during the interview.,3
They organized a article focused on islamic rights.,3
There's a survey discussing muslim history.,3
"At the festival, there was a panel on islam.",3
There's a symposium discussing muslim history.,3
islam was the main topic at the exhibit.,3
There's a report discussing religion history.,3
islam was the main topic at the seminar.,3
jews was the main topic at the gallery.,3
I read a documentary on jews culture.,3
muslim was the main topic at the survey.,3
"At the webinar, there was a panel on isis.",3
There's a interview discussing islamic history.,3
quran was the main topic at the lecture.,3
quran was the main topic at the podcast.,3
There's a seminar discussing religion history.,3
The recent gallery covered quran topics.,3
She mentioned muslims during the meeting.,3
She mentioned muslims during the lecture.,3
The recent webinar covered muslim topics.,3
She mentioned rt during the webinar.,3
I found the study on muslims fascinating.,3
"At the workshop, there was a panel on rt.",3
The recent webinar covered rt topics.,3
"At the festival, there was a panel on rt.",3
I read a lecture on mohammed culture.,3
There's a article discussing rt history.,3
I attended a festival about quran issues.,3
She mentioned religion during the interview.,3
The recent survey covered islam topics.,3
There's a meeting discussing quran history.,3
The recent meeting covered religion topics.,3
She mentioned isis during the gallery.,3
"At the forum, there was a panel on mohammed.",3
The recent discussion covered rt topics.,3
mohammed was the main topic at the exhibit.,3
I read a symposium on quran culture.,3
"At the symposium, there was a panel on muslim.",3
I attended a meeting about islam issues.,3
I found the conference on rt fascinating.,3
I read a exhibit on quran culture.,3
They organized a documentary focused on religion rights.,3
"At the documentary, there was a panel on mohammed.",3
They organized a webinar focused on islamic rights.,3
She mentioned isis during the exhibit.,3
religion was the main topic at the panel.,3
The recent forum covered religion topics.,3
She mentioned jews during the exhibit.,3
rt was the main topic at the seminar.,3
islam was the main topic at the festival.,3
mohammed was the main topic at the interview.,3
The recent documentary covered jews topics.,3
The recent study covered quran topics.,3
"At the workshop, there was a panel on mohammed.",3
There's a symposium discussing isis history.,3
They organized a documentary focused on muslims rights.,3
There's a documentary discussing islamic history.,3
There's a conference discussing quran history.,3
"At the gallery, there was a panel on islam.",3
I read a festival on isis culture.,3
They organized a symposium focused on islam rights.,3
The symposium on religion was enlightening.,3
I found the forum on islam fascinating.,3
They organized a survey focused on jews rights.,3
The seminar on muslims was enlightening.,3
The recent panel covered religion topics.,3
She mentioned jews during the webinar.,3
The report on jews was enlightening.,3
muslims was the main topic at the exhibit.,3
I found the lecture on jews fascinating.,3
The festival on quran was enlightening.,3
I attended a seminar about islamic issues.,3
They organized a workshop focused on muslim rights.,3
rt was the main topic at the exhibit.,3
The study on muslims was enlightening.,3
She mentioned jews during the documentary.,3
I read a exhibit on islamic culture.,3
They organized a documentary focused on muslim rights.,3
I attended a discussion about quran issues.,3
I found the interview on muslims fascinating.,3
She mentioned muslim during the discussion.,3
I attended a study about muslims issues.,3
The recent forum covered muslims topics.,3
I attended a discussion about muslim issues.,3
jews was the main topic at the exhibit.,3
I attended a conference about quran issues.,3
islamic was the main topic at the conference.,3
I found the gallery on muslims fascinating.,3
There's a panel discussing religion history.,3
"At the workshop, there was a panel on religion.",3
"At the festival, there was a panel on isis.",3
There's a interview discussing muslim history.,3
The webinar on mohammed was enlightening.,3
The recent report covered quran topics.,3
I found the webinar on isis fascinating.,3
The recent panel covered muslims topics.,3
The exhibit on muslim was enlightening.,3
I found the report on quran fascinating.,3
The seminar on religion was enlightening.,3
They organized a lecture focused on muslims rights.,3
I read a forum on jews culture.,3
They organized a documentary focused on rt rights.,3
I attended a discussion about isis issues.,3
jews was the main topic at the panel.,3
There's a meeting discussing muslim history.,3
I found the podcast on jews fascinating.,3
The recent meeting covered isis topics.,3
The panel on islamic was enlightening.,3
I found the symposium on muslims fascinating.,3
I found the interview on quran fascinating.,3
"At the lecture, there was a panel on jews.",3
The webinar on islam was enlightening.,3
I read a panel on islamic culture.,3
"At the meeting, there was a panel on mohammed.",3
I read a webinar on quran culture.,3
The lecture on islamic was enlightening.,3
The recent documentary covered muslim topics.,3
I read a gallery on mohammed culture.,3
I attended a festival about isis issues.,3
"At the forum, there was a panel on islamic.",3
There's a seminar discussing muslim history.,3
She mentioned islamic during the article.,3
I found the symposium on jews fascinating.,3
I read a article on quran culture.,3
They organized a exhibit focused on rt rights.,3
I attended a gallery about muslims issues.,3
I read a article on islamic culture.,3
"At the meeting, there was a panel on religion.",3
There's a meeting discussing jews history.,3
I read a gallery on islam culture.,3
They organized a study focused on religion rights.,3
I attended a lecture about religion issues.,3
There's a forum discussing muslims history.,3
I attended a workshop about muslim issues.,3
The recent study covered islam topics.,3
I found the podcast on quran fascinating.,3
There's a study discussing isis history.,3
I read a workshop on muslim culture.,3
The recent podcast covered muslim topics.,3
I read a survey on muslim culture.,3
islam was the main topic at the conference.,3
I read a panel on isis culture.,3
They organized a survey focused on mohammed rights.,3
The study on rt was enlightening.,3
The discussion on isis was enlightening.,3
There's a interview discussing muslims history.,3
"At the festival, there was a panel on jews.",3
I attended a podcast about muslims issues.,3
The article on islamic was enlightening.,3
religion was the main topic at the seminar.,3
The festival on islamic was enlightening.,3
There's a exhibit discussing muslims history.,3
They organized a conference focused on isis rights.,3
I attended a exhibit about rt issues.,3
I attended a interview about mohammed issues.,3
"At the discussion, there was a panel on rt.",3
The recent podcast covered jews topics.,3
I read a discussion on jews culture.,3
The recent panel covered isis topics.,3
The survey on mohammed was enlightening.,3
"At the panel, there was a panel on muslim.",3
"At the discussion, there was a panel on religion.",3
I found the gallery on quran fascinating.,3
She mentioned religion during the symposium.,3
I read a study on quran culture.,3
The workshop on rt was enlightening.,3
They organized a symposium focused on rt rights.,3
They organized a meeting focused on rt rights.,3
I read a festival on mohammed culture.,3
The recent documentary covered mohammed topics.,3
They organized a gallery focused on isis rights.,3
She mentioned muslims during the panel.,3
I found the lecture on rt fascinating.,3
"At the conference, there was a panel on muslims.",3
I found the panel on muslim fascinating.,3
rt was the main topic at the meeting.,3
I found the panel on mohammed fascinating.,3
I attended a webinar about rt issues.,3
There's a workshop discussing muslim history.,3
I found the discussion on islam fascinating.,3
isis was the main topic at the meeting.,3
The gallery on jews was enlightening.,3
I read a podcast on muslims culture.,3
"At the seminar, there was a panel on muslim.",3
I attended a article about quran issues.,3
I attended a study about rt issues.,3
The recent exhibit covered religion topics.,3
I read a exhibit on islam culture.,3
There's a conference discussing muslims history.,3
I read a forum on mohammed culture.,3
There's a forum discussing muslim history.,3
islam was the main topic at the podcast.,3
The recent article covered religion topics.,3
I read a lecture on jews culture.,3
There's a documentary discussing quran history.,3
I read a lecture on rt culture.,3
I found the lecture on mohammed fascinating.,3
I attended a panel about mohammed issues.,3
She mentioned muslim during the report.,3
There's a documentary discussing islam history.,3
The recent interview covered muslim topics.,3
The recent interview covered islamic topics.,3
There's a lecture discussing religion history.,3
They organized a article focused on mohammed rights.,3
I read a study on muslims culture.,3
The podcast on rt was enlightening.,3
mohammed was the main topic at the webinar.,3
The recent survey covered rt topics.,3
quran was the main topic at the symposium.,3
The report on religion was enlightening.,3
I read a gallery on muslims culture.,3
I attended a seminar about jews issues.,3
They organized a meeting focused on mohammed rights.,3
She mentioned jews during the panel.,3
"At the gallery, there was a panel on muslim.",3
"At the gallery, there was a panel on isis.",3
The documentary on islam was enlightening.,3
They organized a podcast focused on muslims rights.,3
I found the lecture on religion fascinating.,3
I read a gallery on jews culture.,3
The survey on religion was enlightening.,3
"At the study, there was a panel on islam.",3
She mentioned muslim during the symposium.,3
I attended a report about religion issues.,3
They organized a documentary focused on isis rights.,3
I read a interview on islamic culture.,3
The recent seminar covered jews topics.,3
quran was the main topic at the gallery.,3
I attended a study about islamic issues.,3
I attended a gallery about muslim issues.,3
muslim was the main topic at the study.,3
"At the article, there was a panel on mohammed.",3
I found the survey on muslim fascinating.,3
The recent festival covered rt topics.,3
isis was the main topic at the symposium.,3
"At the exhibit, there was a panel on rt.",3
"At the panel, there was a panel on islam.",3
"At the podcast, there was a panel on religion.",3
There's a interview discussing isis history.,3
I read a webinar on isis culture.,3
There's a lecture discussing quran history.,3
She mentioned isis during the discussion.,3
"At the article, there was a panel on isis.",3
She mentioned quran during the survey.,3
The forum on isis was enlightening.,3
I read a conference on islam culture.,3
I read a study on mohammed culture.,3
She mentioned quran during the article.,3
The recent meeting covered rt topics.,3
"At the forum, there was a panel on quran.",3
I attended a gallery about islam issues.,3
I found the discussion on mohammed fascinating.,3
"At the study, there was a panel on muslim.",3
The exhibit on mohammed was enlightening.,3
They organized a lecture focused on muslim rights.,3
The documentary on muslim was enlightening.,3
There's a panel discussing islamic history.,3
They organized a workshop focused on muslims rights.,3
There's a survey discussing islamic history.,3
rt was the main topic at the conference.,3
I found the exhibit on islamic fascinating.,3
She mentioned quran during the festival.,3
The recent conference covered rt topics.,3
muslim was the main topic at the conference.,3
"At the gallery, there was a panel on rt.",3
"At the documentary, there was a panel on jews.",3
She mentioned religion during the podcast.,3
There's a festival discussing islamic history.,3
The recent survey covered muslim topics.,3
I found the report on islamic fascinating.,3
I attended a meeting about isis issues.,3
"At the conference, there was a panel on rt.",3
The recent interview covered mohammed topics.,3
mohammed was the main topic at the panel.,3
I found the meeting on islam fascinating.,3
I read a conference on isis culture.,3
I attended a meeting about quran issues.,3
The symposium on rt was enlightening.,3
I attended a documentary about jews issues.,3
She mentioned mohammed during the exhibit.,3
"At the conference, there was a panel on isis.",3
They organized a festival focused on religion rights.,3
"At the podcast, there was a panel on islam.",3
I attended a festival about muslims issues.,3
mohammed was the main topic at the conference.,3
The recent article covered rt topics.,3
I read a seminar on isis culture.,3
I found the discussion on muslims fascinating.,3
There's a webinar discussing islam history.,3
muslim was the main topic at the forum.,3
They organized a lecture focused on rt rights.,3
isis was the main topic at the podcast.,3
I attended a discussion about jews issues.,3
I attended a workshop about quran issues.,3
"At the lecture, there was a panel on rt.",3
The seminar on rt was enlightening.,3
islam was the main topic at the discussion.,3
I attended a seminar about mohammed issues.,3
I found the forum on isis fascinating.,3
I read a webinar on religion culture.,3
They organized a documentary focused on islamic rights.,3
I read a symposium on jews culture.,3
isis was the main topic at the documentary.,3
jews was the main topic at the documentary.,3
The recent survey covered mohammed topics.,3
She mentioned isis during the interview.,3
There's a interview discussing religion history.,3
I attended a festival about rt issues.,3
They organized a lecture focused on religion rights.,3
There's a article discussing isis history.,3
There's a symposium discussing mohammed history.,3
They organized a forum focused on islamic rights.,3
The lecture on mohammed was enlightening.,3
The recent lecture covered muslims topics.,3
They organized a seminar focused on religion rights.,3
They organized a symposium focused on islamic rights.,3
I read a festival on muslims culture.,3
"At the webinar, there was a panel on muslims.",3
I read a panel on quran culture.,3
There's a lecture discussing islamic history.,3
They organized a festival focused on rt rights.,3
She mentioned isis during the festival.,3
I found the symposium on islam fascinating.,3
rt was the main topic at the study.,3
She mentioned islam during the documentary.,3
"At the article, there was a panel on muslims.",3
There's a workshop discussing isis history.,3
There's a conference discussing isis history.,3
I found the workshop on islam fascinating.,3
There's a lecture discussing muslims history.,3
I found the documentary on muslims fascinating.,3
The documentary on religion was enlightening.,3
I attended a report about isis issues.,3
I read a panel on rt culture.,3
The workshop on muslims was enlightening.,3
isis was the main topic at the panel.,3
There's a exhibit discussing religion history.,3
She mentioned muslim during the webinar.,3
I found the forum on religion fascinating.,3
"At the panel, there was a panel on islamic.",3
I attended a lecture about rt issues.,3
She mentioned muslims during the interview.,3
The recent meeting covered quran topics.,3
I read a forum on muslim culture.,3
religion was the main topic at the lecture.,3
The recent exhibit covered mohammed topics.,3
"At the podcast, there was a panel on islamic.",3
I found the article on jews fascinating.,3
islamic was the main topic at the meeting.,3
I attended a exhibit about islam issues.,3
There's a meeting discussing isis history.,3
quran was the main topic at the panel.,3
islamic was the main topic at the lecture.,3
They organized a gallery focused on religion rights.,3
They organized a discussion focused on rt rights.,3
I attended a podcast about mohammed issues.,3
The recent forum covered islamic topics.,3
I attended a interview about isis issues.,3
I attended a documentary about mohammed issues.,3
They organized a article focused on isis rights.,3
I attended a workshop about religion issues.,3
mohammed was the main topic at the study.,3
"At the workshop, there was a panel on quran.",3
I read a seminar on mohammed culture.,3
The recent gallery covered muslims topics.,3
She mentioned muslim during the forum.,3
She mentioned muslims during the conference.,3
I found the documentary on jews fascinating.,3
The recent forum covered rt topics.,3
The recent podcast covered rt topics.,3
I read a report on religion culture.,3
"At the report, there was a panel on islam.",3
I found the seminar on religion fascinating.,3
I found the survey on mohammed fascinating.,3
The recent seminar covered rt topics.,3
The podcast on muslim was enlightening.,3
I found the workshop on muslims fascinating.,3
I attended a gallery about religion issues.,3
There's a survey discussing rt history.,3
The exhibit on islam was enlightening.,3
"At the discussion, there was a panel on quran.",3
There's a exhibit discussing mohammed history.,3
They organized a forum focused on isis rights.,3
quran was the main topic at the study.,3
She mentioned jews during the article.,3
There's a meeting discussing religion history.,3
I attended a discussion about mohammed issues.,3
I found the documentary on mohammed fascinating.,3
The recent festival covered islamic topics.,3
I attended a survey about mohammed issues.,3
I read a article on religion culture.,3
There's a exhibit discussing jews history.,3
rt was the main topic at the workshop.,3
The recent conference covered muslims topics.,3
I found the conference on mohammed fascinating.,3
The recent study covered rt topics.,3
The meeting on quran was enlightening.,3
I found the survey on isis fascinating.,3
I found the documentary on rt fascinating.,3
There's a discussion discussing islam history.,3
They organized a workshop focused on mohammed rights.,3
There's a lecture discussing mohammed history.,3
"At the exhibit, there was a panel on isis.",3
They organized a documentary focused on jews rights.,3
I read a exhibit on jews culture.,3
I read a panel on muslims culture.,3
The interview on islamic was enlightening.,3
They organized a podcast focused on jews rights.,3
She mentioned islamic during the interview.,3
They organized a study focused on quran rights.,3
The recent webinar covered muslims topics.,3
They organized a webinar focused on islam rights.,3
muslim was the main topic at the symposium.,3
I read a symposium on islamic culture.,3
"At the study, there was a panel on jews.",3
"At the meeting, there was a panel on isis.",3
I read a workshop on rt culture.,3
She mentioned mohammed during the workshop.,3
I read a conference on jews culture.,3
I found the workshop on muslim fascinating.,3
I found the conference on islamic fascinating.,3
I found the conference on isis fascinating.,3
There's a survey discussing quran history.,3
She mentioned rt during the discussion.,3
"At the documentary, there was a panel on islam.",3
The recent study covered muslims topics.,3
I found the meeting on islamic fascinating.,3
The recent study covered isis topics.,3
I read a study on muslim culture.,3
The study on muslim was enlightening.,3
I found the forum on jews fascinating.,3
I found the webinar on mohammed fascinating.,3
There's a discussion discussing jews history.,3
The recent gallery covered rt topics.,3
I attended a seminar about rt issues.,3
The lecture on muslim was enlightening.,3
I read a lecture on muslims culture.,3
I read a conference on rt culture.,3
I attended a gallery about quran issues.,3
The interview on islam was enlightening.,3
The seminar on islamic was enlightening.,3
The article on rt was enlightening.,3
I found the survey on quran fascinating.,3
They organized a meeting focused on religion rights.,3
"At the conference, there was a panel on muslim.",3
I found the exhibit on islam fascinating.,3
The study on mohammed was enlightening.,3
I read a report on jews culture.,3
The seminar on mohammed was enlightening.,3
They organized a podcast focused on muslim rights.,3
The webinar on islamic was enlightening.,3
There's a survey discussing jews history.,3
I found the forum on muslim fascinating.,3
The panel on jews was enlightening.,3
She mentioned jews during the survey.,3
muslims was the main topic at the festival.,3
She mentioned islamic during the survey.,3
The recent interview covered isis topics.,3
The meeting on muslim was enlightening.,3
mohammed was the main topic at the workshop.,3
They organized a panel focused on religion rights.,3
"At the podcast, there was a panel on muslim.",3
She mentioned quran during the study.,3
She mentioned rt during the symposium.,3
I read a exhibit on muslim culture.,3
muslim was the main topic at the meeting.,3
They organized a meeting focused on jews rights.,3
She mentioned muslim during the lecture.,3
The festival on muslims was enlightening.,3
She mentioned jews during the report.,3
The recent festival covered religion topics.,3
I found the interview on rt fascinating.,3
The discussion on mohammed was enlightening.,3
I read a festival on rt culture.,3
She mentioned religion during the seminar.,3
She mentioned quran during the exhibit.,3
There's a study discussing religion history.,3
I attended a documentary about muslim issues.,3
I read a article on muslim culture.,3
The recent article covered quran topics.,3
The discussion on religion was enlightening.,3
The recent interview covered religion topics.,3
I found the study on muslim fascinating.,3
They organized a report focused on rt rights.,3
I read a webinar on rt culture.,3
mohammed was the main topic at the forum.,3
There's a study discussing muslim history.,3
I read a documentary on islam culture.,3
She mentioned isis during the report.,3
islamic was the main topic at the study.,3
The gallery on rt was enlightening.,3
There's a article discussing mohammed history.,3
I found the panel on muslims fascinating.,3
The meeting on isis was enlightening.,3
They organized a exhibit focused on quran rights.,3
I attended a interview about islam issues.,3
I read a documentary on isis culture.,3
The recent interview covered jews topics.,3
I read a meeting on muslim culture.,3
I found the interview on jews fascinating.,3
The panel on muslim was enlightening.,3
I attended a survey about quran issues.,3
The recent festival covered muslim topics.,3
The recent seminar covered muslims topics.,3
She mentioned islamic during the forum.,3
I found the seminar on islam fascinating.,3
I attended a festival about islam issues.,3
There's a festival discussing jews history.,3
The seminar on quran was enlightening.,3
The recent workshop covered isis topics.,3
The documentary on mohammed was enlightening.,3
isis was the main topic at the webinar.,3
I found the article on rt fascinating.,3
They organized a report focused on islam rights.,3
The recent forum covered mohammed topics.,3
muslims was the main topic at the survey.,3
I found the panel on quran fascinating.,3
I attended a meeting about muslims issues.,3
There's a discussion discussing muslims history.,3
The recent meeting covered jews topics.,3
The recent symposium covered islamic topics.,3
I read a lecture on islam culture.,3
"At the panel, there was a panel on isis.",3
"At the seminar, there was a panel on muslims.",3
The recent article covered jews topics.,3
"At the conference, there was a panel on islam.",3
There's a documentary discussing religion history.,3
I found the podcast on muslims fascinating.,3
The seminar on muslim was enlightening.,3
The article on islam was enlightening.,3
She mentioned muslims during the festival.,3
They organized a gallery focused on islam rights.,3
She mentioned rt during the interview.,3
islamic was the main topic at the gallery.,3
The webinar on quran was enlightening.,3
The symposium on quran was enlightening.,3
The lecture on jews was enlightening.,3
She mentioned islamic during the meeting.,3
There's a workshop discussing religion history.,3
jews was the main topic at the conference.,3
There's a report discussing isis history.,3
I attended a lecture about muslim issues.,3
She mentioned jews during the festival.,3
"At the seminar, there was a panel on islam.",3
religion was the main topic at the interview.,3
I attended a seminar about muslims issues.,3
I attended a forum about islam issues.,3
I attended a lecture about mohammed issues.,3
The festival on isis was enlightening.,3
The recent seminar covered muslim topics.,3
The conference on rt was enlightening.,3
I found the conference on jews fascinating.,3
The panel on islam was enlightening.,3
The recent gallery covered mohammed topics.,3
I attended a symposium about islam issues.,3
I read a conference on religion culture.,3
"At the festival, there was a panel on religion.",3
"At the webinar, there was a panel on islam.",3
They organized a forum focused on muslims rights.,3
I read a symposium on isis culture.,3
I attended a gallery about jews issues.,3
