text,category
She mentioned fag during the panel.,3
I found the exhibit on im fascinating.,3
"At the study, there was a panel on straight.",3
They organized a workshop focused on straight rights.,3
I read a article on got culture.,3
She mentioned dyke during the report.,3
"At the interview, there was a panel on queer.",3
They organized a gallery focused on fag rights.,3
There's a podcast discussing faggot history.,3
I attended a exhibit about dyke issues.,3
fucking was the main topic at the report.,3
I read a seminar on fucking culture.,3
I read a survey on dyke culture.,3
"At the article, there was a panel on dyke.",3
There's a interview discussing fucking history.,3
The report on dyke was enlightening.,3
"At the gallery, there was a panel on straight.",3
They organized a interview focused on queer rights.,3
She mentioned fucking during the study.,3
There's a study discussing dyke history.,3
"At the article, there was a panel on homo.",3
fag was the main topic at the panel.,3
She mentioned im during the report.,3
The podcast on faggot was enlightening.,3
I read a conference on gay culture.,3
I attended a report about faggot issues.,3
They organized a gallery focused on queer rights.,3
I read a meeting on straight culture.,3
There's a forum discussing got history.,3
I attended a gallery about im issues.,3
I read a documentary on fucking culture.,3
There's a webinar discussing dyke history.,3
"At the podcast, there was a panel on im.",3
The recent study covered fag topics.,3
They organized a meeting focused on im rights.,3
The recent documentary covered faggot topics.,3
They organized a interview focused on dyke rights.,3
The symposium on dyke was enlightening.,3
got was the main topic at the exhibit.,3
The study on straight was enlightening.,3
The recent festival covered fucking topics.,3
I read a workshop on got culture.,3
The workshop on homo was enlightening.,3
"At the study, there was a panel on faggot.",3
She mentioned fag during the report.,3
I attended a festival about faggot issues.,3
I attended a article about fucking issues.,3
She mentioned got during the report.,3
There's a webinar discussing homo history.,3
I attended a survey about fag issues.,3
They organized a study focused on straight rights.,3
There's a exhibit discussing queer history.,3
I found the forum on dyke fascinating.,3
The recent panel covered im topics.,3
The recent gallery covered fucking topics.,3
I found the report on gay fascinating.,3
There's a exhibit discussing dyke history.,3
I read a report on fucking culture.,3
I attended a discussion about straight issues.,3
fucking was the main topic at the discussion.,3
There's a study discussing queer history.,3
She mentioned got during the webinar.,3
There's a exhibit discussing gay history.,3
She mentioned gay during the workshop.,3
The seminar on im was enlightening.,3
I found the festival on homo fascinating.,3
The recent study covered dyke topics.,3
I read a survey on fag culture.,3
"At the festival, there was a panel on faggot.",3
The recent symposium covered fag topics.,3
I read a lecture on queer culture.,3
The study on fucking was enlightening.,3
She mentioned got during the meeting.,3
I found the panel on faggot fascinating.,3
straight was the main topic at the webinar.,3
I attended a study about fucking issues.,3
fag was the main topic at the report.,3
There's a conference discussing homo history.,3
They organized a podcast focused on gay rights.,3
I read a conference on fucking culture.,3
queer was the main topic at the report.,3
She mentioned gay during the exhibit.,3
The recent workshop covered fag topics.,3
The recent article covered straight topics.,3
The gallery on got was enlightening.,3
homo was the main topic at the discussion.,3
The recent podcast covered faggot topics.,3
I found the forum on faggot fascinating.,3
I found the interview on queer fascinating.,3
They organized a article focused on gay rights.,3
The recent gallery covered got topics.,3
"At the seminar, there was a panel on fag.",3
They organized a festival focused on faggot rights.,3
She mentioned fag during the workshop.,3
"At the lecture, there was a panel on queer.",3
The recent webinar covered dyke topics.,3
They organized a discussion focused on fucking rights.,3
I read a conference on dyke culture.,3
The recent interview covered im topics.,3
I found the lecture on homo fascinating.,3
The recent forum covered dyke topics.,3
"At the meeting, there was a panel on homo.",3
They organized a documentary focused on fucking rights.,3
I read a documentary on homo culture.,3
"At the seminar, there was a panel on fucking.",3
I read a article on fucking culture.,3
She mentioned dyke during the podcast.,3
They organized a exhibit focused on straight rights.,3
The recent lecture covered im topics.,3
dyke was the main topic at the survey.,3
gay was the main topic at the workshop.,3
There's a gallery discussing fucking history.,3
They organized a study focused on fag rights.,3
They organized a conference focused on homo rights.,3
I read a gallery on straight culture.,3
The meeting on fucking was enlightening.,3
I read a forum on dyke culture.,3
There's a interview discussing queer history.,3
The recent panel covered fucking topics.,3
She mentioned gay during the symposium.,3
The recent discussion covered fag topics.,3
She mentioned homo during the symposium.,3
The conference on got was enlightening.,3
fucking was the main topic at the panel.,3
There's a study discussing faggot history.,3
She mentioned homo during the report.,3
They organized a discussion focused on homo rights.,3
The exhibit on fag was enlightening.,3
I attended a forum about got issues.,3
There's a podcast discussing fag history.,3
The recent conference covered faggot topics.,3
queer was the main topic at the gallery.,3
The recent symposium covered straight topics.,3
"At the podcast, there was a panel on got.",3
They organized a discussion focused on gay rights.,3
straight was the main topic at the exhibit.,3
straight was the main topic at the survey.,3
The webinar on queer was enlightening.,3
There's a documentary discussing gay history.,3
They organized a survey focused on got rights.,3
gay was the main topic at the festival.,3
There's a podcast discussing gay history.,3
I found the survey on queer fascinating.,3
I attended a discussion about dyke issues.,3
The recent podcast covered straight topics.,3
She mentioned homo during the conference.,3
I found the survey on fag fascinating.,3
I attended a documentary about straight issues.,3
The panel on straight was enlightening.,3
I attended a report about queer issues.,3
I read a study on fucking culture.,3
The recent gallery covered dyke topics.,3
The lecture on faggot was enlightening.,3
They organized a study focused on queer rights.,3
There's a festival discussing dyke history.,3
"At the symposium, there was a panel on fag.",3
The meeting on fag was enlightening.,3
I read a report on dyke culture.,3
The recent gallery covered faggot topics.,3
I found the conference on homo fascinating.,3
She mentioned fag during the podcast.,3
"At the symposium, there was a panel on gay.",3
She mentioned queer during the article.,3
got was the main topic at the webinar.,3
There's a symposium discussing im history.,3
I attended a conference about homo issues.,3
The study on im was enlightening.,3
The seminar on faggot was enlightening.,3
straight was the main topic at the seminar.,3
I attended a symposium about faggot issues.,3
The recent conference covered dyke topics.,3
I found the gallery on gay fascinating.,3
"At the gallery, there was a panel on queer.",3
The recent study covered fucking topics.,3
I read a discussion on homo culture.,3
I read a seminar on straight culture.,3
The recent study covered im topics.,3
I read a festival on queer culture.,3
I attended a documentary about fag issues.,3
The recent interview covered dyke topics.,3
I read a discussion on got culture.,3
They organized a gallery focused on im rights.,3
There's a festival discussing homo history.,3
She mentioned straight during the webinar.,3
"At the podcast, there was a panel on fucking.",3
I read a workshop on queer culture.,3
She mentioned queer during the seminar.,3
I found the festival on fucking fascinating.,3
She mentioned fag during the festival.,3
The forum on gay was enlightening.,3
I read a study on homo culture.,3
I attended a forum about fucking issues.,3
I read a symposium on dyke culture.,3
"At the report, there was a panel on got.",3
She mentioned fucking during the gallery.,3
straight was the main topic at the interview.,3
I attended a symposium about gay issues.,3
I attended a interview about im issues.,3
There's a survey discussing straight history.,3
I read a study on faggot culture.,3
She mentioned straight during the meeting.,3
I attended a gallery about fucking issues.,3
She mentioned dyke during the documentary.,3
The recent exhibit covered faggot topics.,3
fag was the main topic at the podcast.,3
I found the discussion on got fascinating.,3
queer was the main topic at the webinar.,3
The festival on straight was enlightening.,3
I attended a symposium about fag issues.,3
I attended a discussion about im issues.,3
I found the workshop on faggot fascinating.,3
"At the seminar, there was a panel on homo.",3
They organized a report focused on gay rights.,3
I attended a podcast about homo issues.,3
She mentioned dyke during the conference.,3
There's a report discussing queer history.,3
I attended a forum about fag issues.,3
I found the workshop on dyke fascinating.,3
"At the lecture, there was a panel on straight.",3
I attended a study about gay issues.,3
I read a article on queer culture.,3
homo was the main topic at the symposium.,3
I read a documentary on faggot culture.,3
dyke was the main topic at the workshop.,3
There's a interview discussing gay history.,3
They organized a conference focused on straight rights.,3
I attended a forum about dyke issues.,3
She mentioned got during the workshop.,3
The symposium on queer was enlightening.,3
They organized a festival focused on straight rights.,3
homo was the main topic at the forum.,3
I read a article on dyke culture.,3
The recent meeting covered gay topics.,3
They organized a podcast focused on faggot rights.,3
I found the report on straight fascinating.,3
There's a workshop discussing got history.,3
fag was the main topic at the seminar.,3
The survey on faggot was enlightening.,3
"At the lecture, there was a panel on fucking.",3
They organized a conference focused on faggot rights.,3
She mentioned dyke during the study.,3
"At the forum, there was a panel on fag.",3
She mentioned dyke during the forum.,3
They organized a lecture focused on queer rights.,3
I found the exhibit on fucking fascinating.,3
"At the article, there was a panel on straight.",3
The gallery on fag was enlightening.,3
I attended a survey about got issues.,3
I attended a seminar about faggot issues.,3
"At the panel, there was a panel on fucking.",3
There's a article discussing fag history.,3
There's a seminar discussing dyke history.,3
The recent podcast covered got topics.,3
There's a meeting discussing got history.,3
fag was the main topic at the meeting.,3
There's a study discussing fucking history.,3
"At the discussion, there was a panel on homo.",3
There's a interview discussing homo history.,3
The survey on queer was enlightening.,3
"At the study, there was a panel on homo.",3
She mentioned gay during the report.,3
The recent gallery covered fag topics.,3
She mentioned faggot during the podcast.,3
There's a webinar discussing got history.,3
"At the discussion, there was a panel on fag.",3
homo was the main topic at the workshop.,3
There's a survey discussing im history.,3
She mentioned fag during the lecture.,3
im was the main topic at the podcast.,3
There's a podcast discussing queer history.,3
The workshop on im was enlightening.,3
"At the report, there was a panel on im.",3
I attended a report about straight issues.,3
I attended a study about faggot issues.,3
The festival on got was enlightening.,3
"At the interview, there was a panel on fag.",3
I read a survey on straight culture.,3
They organized a seminar focused on queer rights.,3
I found the seminar on fucking fascinating.,3
"At the documentary, there was a panel on im.",3
She mentioned faggot during the festival.,3
"At the conference, there was a panel on dyke.",3
They organized a lecture focused on fucking rights.,3
"At the symposium, there was a panel on queer.",3
I attended a study about im issues.,3
"At the survey, there was a panel on fag.",3
There's a forum discussing homo history.,3
The recent meeting covered fag topics.,3
I read a documentary on dyke culture.,3
She mentioned homo during the webinar.,3
fag was the main topic at the interview.,3
I found the lecture on straight fascinating.,3
I found the discussion on faggot fascinating.,3
She mentioned gay during the seminar.,3
I found the panel on gay fascinating.,3
"At the lecture, there was a panel on dyke.",3
They organized a meeting focused on faggot rights.,3
The festival on faggot was enlightening.,3
They organized a workshop focused on gay rights.,3
I found the exhibit on gay fascinating.,3
fucking was the main topic at the webinar.,3
I read a lecture on dyke culture.,3
She mentioned faggot during the webinar.,3
She mentioned got during the exhibit.,3
I read a panel on im culture.,3
She mentioned got during the survey.,3
"At the panel, there was a panel on got.",3
She mentioned fag during the meeting.,3
"At the exhibit, there was a panel on fucking.",3
She mentioned im during the exhibit.,3
The recent meeting covered dyke topics.,3
I attended a seminar about straight issues.,3
"At the report, there was a panel on fag.",3
They organized a survey focused on homo rights.,3
The documentary on straight was enlightening.,3
She mentioned dyke during the symposium.,3
I found the podcast on homo fascinating.,3
I found the study on fucking fascinating.,3
The recent symposium covered fucking topics.,3
She mentioned queer during the interview.,3
The recent study covered straight topics.,3
They organized a workshop focused on homo rights.,3
The festival on dyke was enlightening.,3
I found the conference on gay fascinating.,3
There's a workshop discussing faggot history.,3
The recent symposium covered faggot topics.,3
dyke was the main topic at the meeting.,3
There's a conference discussing dyke history.,3
I attended a interview about gay issues.,3
There's a exhibit discussing straight history.,3
straight was the main topic at the festival.,3
The podcast on im was enlightening.,3
I found the symposium on fag fascinating.,3
The discussion on dyke was enlightening.,3
gay was the main topic at the meeting.,3
I attended a meeting about fucking issues.,3
She mentioned fucking during the workshop.,3
She mentioned straight during the exhibit.,3
I attended a study about homo issues.,3
The recent article covered fucking topics.,3
I attended a workshop about queer issues.,3
I found the workshop on homo fascinating.,3
I read a forum on im culture.,3
I attended a documentary about im issues.,3
I attended a exhibit about fucking issues.,3
I found the podcast on got fascinating.,3
There's a article discussing queer history.,3
"At the meeting, there was a panel on dyke.",3
The meeting on got was enlightening.,3
There's a panel discussing homo history.,3
"At the workshop, there was a panel on fag.",3
I attended a festival about fag issues.,3
She mentioned faggot during the discussion.,3
I read a festival on fucking culture.,3
The recent forum covered gay topics.,3
I attended a article about fag issues.,3
"At the seminar, there was a panel on queer.",3
She mentioned queer during the study.,3
She mentioned homo during the podcast.,3
The lecture on queer was enlightening.,3
The recent interview covered gay topics.,3
I attended a webinar about got issues.,3
She mentioned got during the panel.,3
fucking was the main topic at the seminar.,3
gay was the main topic at the podcast.,3
I found the webinar on straight fascinating.,3
There's a discussion discussing faggot history.,3
The gallery on queer was enlightening.,3
straight was the main topic at the podcast.,3
There's a webinar discussing faggot history.,3
I found the study on dyke fascinating.,3
I found the discussion on dyke fascinating.,3
"At the article, there was a panel on im.",3
The recent discussion covered gay topics.,3
"At the seminar, there was a panel on gay.",3
I read a symposium on gay culture.,3
I read a webinar on dyke culture.,3
"At the forum, there was a panel on gay.",3
I found the workshop on straight fascinating.,3
They organized a discussion focused on queer rights.,3
The recent festival covered fag topics.,3
There's a lecture discussing dyke history.,3
I found the lecture on gay fascinating.,3
There's a exhibit discussing faggot history.,3
There's a documentary discussing dyke history.,3
dyke was the main topic at the report.,3
I attended a gallery about faggot issues.,3
She mentioned got during the discussion.,3
The recent workshop covered homo topics.,3
She mentioned homo during the lecture.,3
The webinar on homo was enlightening.,3
There's a study discussing got history.,3
They organized a gallery focused on homo rights.,3
She mentioned fag during the survey.,3
There's a webinar discussing fucking history.,3
The meeting on straight was enlightening.,3
They organized a festival focused on dyke rights.,3
queer was the main topic at the forum.,3
The recent meeting covered got topics.,3
She mentioned im during the meeting.,3
There's a symposium discussing fucking history.,3
"At the report, there was a panel on faggot.",3
I attended a seminar about queer issues.,3
I attended a panel about faggot issues.,3
She mentioned im during the podcast.,3
She mentioned faggot during the study.,3
just was the main topic at the exhibit.,3
I found the symposium on shes fascinating.,3
The recent lecture covered girls topics.,3
I read a article on female culture.,3
There's a conference discussing female history.,3
The webinar on bitch was enlightening.,3
I found the lecture on woman fascinating.,3
I attended a study about url issues.,3
They organized a webinar focused on shes rights.,3
I found the lecture on women fascinating.,3
The recent conference covered url topics.,3
"At the webinar, there was a panel on girls.",3
I read a panel on cunt culture.,3
There's a webinar discussing women history.,3
"At the documentary, there was a panel on shes.",3
I found the festival on bitch fascinating.,3
cunt was the main topic at the festival.,3
She mentioned girls during the workshop.,3
The recent lecture covered woman topics.,3
The recent discussion covered girls topics.,3
She mentioned url during the gallery.,3
She mentioned woman during the report.,3
The recent meeting covered female topics.,3
There's a festival discussing bitch history.,3
"At the panel, there was a panel on girls.",3
The recent podcast covered just topics.,3
There's a discussion discussing women history.,3
They organized a exhibit focused on bitch rights.,3
women was the main topic at the lecture.,3
There's a festival discussing pussy history.,3
The workshop on pussy was enlightening.,3
The recent symposium covered url topics.,3
She mentioned cunt during the forum.,3
She mentioned pussy during the symposium.,3
The recent interview covered bitch topics.,3
The interview on female was enlightening.,3
I attended a interview about female issues.,3
"At the gallery, there was a panel on pussy.",3
The recent interview covered just topics.,3
There's a workshop discussing woman history.,3
She mentioned woman during the webinar.,3
They organized a webinar focused on cunt rights.,3
I attended a workshop about woman issues.,3
The study on female was enlightening.,3
She mentioned just during the festival.,3
She mentioned bitch during the seminar.,3
The panel on pussy was enlightening.,3
She mentioned bitch during the conference.,3
There's a gallery discussing pussy history.,3
She mentioned cunt during the exhibit.,3
I read a podcast on women culture.,3
I read a discussion on woman culture.,3
She mentioned female during the exhibit.,3
I found the documentary on url fascinating.,3
The study on pussy was enlightening.,3
"At the survey, there was a panel on shes.",3
The recent report covered shes topics.,3
I found the webinar on bitch fascinating.,3
The forum on woman was enlightening.,3
I attended a conference about shes issues.,3
The symposium on url was enlightening.,3
She mentioned pussy during the lecture.,3
I attended a report about woman issues.,3
The recent webinar covered woman topics.,3
I attended a report about female issues.,3
There's a podcast discussing female history.,3
There's a webinar discussing female history.,3
The recent gallery covered cunt topics.,3
I attended a festival about just issues.,3
The recent lecture covered shes topics.,3
I read a gallery on cunt culture.,3
woman was the main topic at the report.,3
There's a article discussing bitch history.,3
I attended a article about female issues.,3
cunt was the main topic at the exhibit.,3
"At the interview, there was a panel on shes.",3
The recent forum covered shes topics.,3
There's a study discussing girls history.,3
They organized a forum focused on female rights.,3
"At the conference, there was a panel on female.",3
There's a discussion discussing cunt history.,3
They organized a symposium focused on women rights.,3
"At the festival, there was a panel on just.",3
"At the webinar, there was a panel on pussy.",3
women was the main topic at the seminar.,3
They organized a study focused on woman rights.,3
There's a podcast discussing just history.,3
They organized a conference focused on pussy rights.,3
They organized a exhibit focused on female rights.,3
The recent panel covered girls topics.,3
"At the gallery, there was a panel on bitch.",3
The recent survey covered pussy topics.,3
I found the conference on url fascinating.,3
She mentioned pussy during the survey.,3
girls was the main topic at the festival.,3
The recent discussion covered bitch topics.,3
just was the main topic at the meeting.,3
I found the festival on pussy fascinating.,3
The recent meeting covered cunt topics.,3
She mentioned pussy during the gallery.,3
The recent panel covered women topics.,3
They organized a podcast focused on bitch rights.,3
She mentioned pussy during the podcast.,3
There's a symposium discussing girls history.,3
There's a webinar discussing girls history.,3
She mentioned url during the survey.,3
"At the gallery, there was a panel on shes.",3
They organized a symposium focused on bitch rights.,3
I attended a report about women issues.,3
She mentioned women during the discussion.,3
I attended a symposium about pussy issues.,3
girls was the main topic at the panel.,3
There's a forum discussing female history.,3
shes was the main topic at the panel.,3
There's a study discussing url history.,3
I read a meeting on shes culture.,3
She mentioned female during the study.,3
I attended a symposium about woman issues.,3
There's a gallery discussing woman history.,3
She mentioned pussy during the workshop.,3
I found the meeting on just fascinating.,3
There's a meeting discussing url history.,3
They organized a meeting focused on shes rights.,3
The recent exhibit covered woman topics.,3
I read a panel on female culture.,3
"At the symposium, there was a panel on female.",3
She mentioned cunt during the discussion.,3
The podcast on just was enlightening.,3
The recent gallery covered female topics.,3
She mentioned shes during the forum.,3
I found the report on pussy fascinating.,3
"At the symposium, there was a panel on cunt.",3
I found the workshop on shes fascinating.,3
"At the forum, there was a panel on shes.",3
The recent conference covered just topics.,3
I found the survey on woman fascinating.,3
She mentioned bitch during the workshop.,3
The report on pussy was enlightening.,3
bitch was the main topic at the podcast.,3
They organized a workshop focused on female rights.,3
She mentioned women during the survey.,3
The lecture on pussy was enlightening.,3
cunt was the main topic at the survey.,3
I attended a survey about bitch issues.,3
I found the lecture on girls fascinating.,3
just was the main topic at the lecture.,3
There's a panel discussing just history.,3
They organized a interview focused on just rights.,3
She mentioned woman during the conference.,3
I found the report on woman fascinating.,3
woman was the main topic at the festival.,3
She mentioned woman during the survey.,3
She mentioned girls during the documentary.,3
female was the main topic at the panel.,3
"At the workshop, there was a panel on cunt.",3
They organized a seminar focused on female rights.,3
They organized a seminar focused on bitch rights.,3
She mentioned url during the study.,3
I read a interview on women culture.,3
url was the main topic at the conference.,3
I attended a podcast about pussy issues.,3
I read a documentary on women culture.,3
I found the meeting on girls fascinating.,3
There's a workshop discussing cunt history.,3
"At the survey, there was a panel on woman.",3
They organized a webinar focused on bitch rights.,3
The recent report covered url topics.,3
They organized a interview focused on girls rights.,3
I found the meeting on women fascinating.,3
I read a article on cunt culture.,3
I attended a report about bitch issues.,3
They organized a meeting focused on woman rights.,3
They organized a lecture focused on women rights.,3
There's a article discussing girls history.,3
bitch was the main topic at the meeting.,3
She mentioned female during the workshop.,3
I read a study on female culture.,3
shes was the main topic at the symposium.,3
I found the report on url fascinating.,3
The report on woman was enlightening.,3
"At the article, there was a panel on woman.",3
I read a interview on woman culture.,3
I attended a conference about girls issues.,3
There's a discussion discussing girls history.,3
The meeting on url was enlightening.,3
